{
  "schema_version": "1.0",
  "type": "iterate",
  "id": "d-3",
  "k": 20,
  "theta": "BU0SRi1RGkwmT6hJYklGRu5IZE1aUmhQwzziUypN8kYcTFpQVEroUPtIpkTCUFNTtEDQSBFNkk3MTFJP0UqHTr5RbEuTUOpKVjheSpFAbEigOZROlETDTBBOi0WwTOFRXk/DTqZHEEy0Rv1NC01jSBVOHU6RQKpLD0j3SJRQdVO9RF5Klk19Rl06cUt/MA1KCFG0TEpOHUS6SZVQM0SJTLhN+U4JSztIc0kiUv5O70avSRRGSEROUIRQtE1DTn49SE/WUvxN91JbQsxFO0T9TVpKw1GwSl5EIEsERzIt8FHaTeBQx1BrU9FQ5VHqJBRNLzLdTrVPkFGQUFNQaE0rRhBNU0HqRghCW0VrT9dNC0i8TcZKx0xDTudMFFFAQC9SXEraSW1HsEAuTstNMVBvSZ9M0kXGT7lRYExSSmRIqkotTsQ+kEu+TW1Hn0hCUKJHXVFcRUlGRUlMPJ1Qyk9FSctK5EWgQmZNK1RzVFFS/05cRyVLhkhzT+5NCUuGUnhMTEyWSIhHtUZnTQRO502cTuxNHkRRRgJKJkgQSfxJ/k2sTihLbUr6TaBOt02bTsJIeETMRlxMRTjBTc9NW09ITHtOglE2P7VBG1JwQUsttVBATUFAhktsTOlOu05SSv48MEvMRHBMR0zoQiJPI0oMS3BNpE6iTs5JkE+ZVNNOiVE=",
  "cert_k": null,
  "shape": [
    4,
    8,
    8
  ]
}
