{
  "schema_version": "1.0",
  "type": "iterate",
  "id": "d-2",
  "k": 0,
  "theta": "3yd4R9pGkU2vSTNOBD4wUCdKwksfSnZIRUHRTdo5WEwzULhJ8VEIUMFR4UXsT8hG1kOsRN1TvEraPKpByFD5SR5ODk2hTgxNgTqHTUxLlkGGQWE+qE+dPz9Q1lBfTfhBAkxAUsRMf090PzVLuERFTKc+LEx/UDlMFEXLSV1CbE8=",
  "cert_k": 12.5,
  "shape": [
    4,
    4,
    4
  ]
}
